id,type,code,comment,seq
1,SEQ,LPC100,"BRCA1 유전자 분석 결과, 질병 연관 돌연변이는 관찰되지 않았습니다.
",11
2,SEQ,LPC101,"BRCA2 유전자 분석 결과, 질병 연관 돌연변이는 관찰되지 않았습니다.
",10
3,SEQ,LPC101,"본 환자에서 BRCA2 유전자에 대한 direct sequencing 결과, Pathogenic VUS (Variant of Unknown Significance) 로 분류되는 c.767_768del, p.(Thr256Lysfs*19) 변이가 Heterozygous로 관찰되었습니다. 환자의 가족에서 BRCA2 부분검사를 추천합니다.",11
4,SEQ,LPC100,"본 환자에서 BRCA1 유전자에 대한 direct sequencing 결과, Pathogenic VUS (Variant of Unknown Significance) 로 분류되는 c. , p. 변이가 Heterozygous로 관찰되었습니다. 환자의 가족에서 BRCA1 부분검사를 추천합니다.",12
5,SEQ,LPC100,"상기 변이는 염기변이 해석에 관한 ACMG 가이드라인에 따라 (PMID: 25741868), 5 단계 염기변이 분류 기준 중 VUS에 해당합니다. 상기 변이의 보다 명확한 임상적 의의 규명을 위해 임상양상을 확인하시기 바라며 가족구성원 간의 segregation study 가 도움이 될 수 있으므로 환자의 가족검사를 추천합니다. ",13
6,SEQ,LPC101,"상기 변이는 염기변이 해석에 관한 ACMG 가이드라인에 따라 (PMID: 25741868), 5 단계 염기변이 분류 기준 중 VUS에 해당합니다. 상기 변이의 보다 명확한 임상적 의의 규명을 위해 임상양상을 확인하시기 바라며 가족구성원 간의 segregation study 가 도움이 될 수 있으므로 환자의 가족검사를 추천합니다. ",2
7,SEQ,LPC100,"상기 변이는 population database에서 다음의 빈도로 보고되었습니다 (0.000882 in KRGDB, 0.00003 in dbSNP-Global).",14
8,SEQ,LPC101,"상기 변이는 population database에서 다음의 빈도로 보고되었습니다 (0.000882 in KRGDB, 0.00003 in dbSNP-Global).",12
9,SEQ,LPC100,"명확한 임상적 의의 규명을 위해 임상양상을 확인하시기 바라며 가족구성원 간의 segregation study 가 도움이 될 수 있으므로, 필요시 환자의 가족검사에서 BRCA2 부분검사를 추천합니다. ",15
10,SEQ,LPC101,"명확한 임상적 의의 규명을 위해 임상양상을 확인하시기 바라며 가족구성원 간의 segregation study 가 도움이 될 수 있으므로, 필요시 환자의 가족검사에서 BRCA2 부분검사를 추천합니다. ",14
12,SEQ,LPE241,"NF2 유전자 분석 결과, 질병 연관 돌연변이는 관찰되지 않았습니다.",0
14,SEQ,LPE221,"PARK2 유전자 분석 결과, 질병 연관 돌연변이는 관찰되지 않았습니다.",0
15,SEQ,LPE302,"MT-ND1, MT-ND4, MT-ND6, MT-CYB 유전자 분석 결과, 질병 연관 돌연변이는 관찰되지 않았습니다.",0
16,SEQ,LPE302,"MT-ND1, MT-ND4, MT-ND6, MT-CYB 유전자 분석 결과, MT-ND1 유전자에서 기보고된 2차 질병연관 돌연변이인 m.3497C>T가 관찰됩니다(Ophthalmic Genet. 1999;20(3):153-60. Biomed Rep. 2018;8(1):51-58.).
LHON 돌연변이는 1차와 2차 변이로 구분되며, 1차 돌연변이는 m.11778G>A, m.3460G>A, m.14484T>C의 염기변이가 해당되며 각각 단독으로 LHON을 유발하는 변이입니다. 2차 돌연변이는 1차 돌연변이가 있는 LHON 환자에서 동반되어 추가적인 영향을 미칠 가능성이 높다고 여겨지거나, 정상 대조군보다 LHON 환자에서 높은 빈도로 관찰되는 변이이나, 2차 돌연변이 단독으로 LHON을 유발하는 것으로 판단하기는 어렵습니다. 본 환자에서 관찰된 변이와 LHON과의 질병연관성 여부의 명확한 규명을 위해 가족검사를 통한 유전형-표현형 분석이 도움이 될 수 있으므로 환자의 가족검사를 추천합니다.",0
17,SEQ,LPE302,"MT-ND1, MT-ND4, MT-ND6, MT-CYB 유전자 분석 결과, MT-ND4 유전자에서 기보고된 2차 질병연관 돌연변이인 m.11696G>A가 관찰됩니다(Biochem Biophys Res Commun. 2006 Feb 3;340(1):69-75).
LHON 돌연변이는 1차와 2차 변이로 구분되며, 1차 돌연변이는 m.11778G>A, m.3460G>A, m.14484T>C의 염기변이가 해당되며 각각 단독으로 LHON을 유발하는 변이입니다. 2차 돌연변이는 1차 돌연변이가 있는 LHON 환자에서 동반되어 추가적인 영향을 미칠 가능성이 높다고 여겨지거나, 정상 대조군보다 LHON 환자에서 높은 빈도로 관찰되는 변이이나, 2차 돌연변이 단독으로 LHON을 유발하는 것으로 판단하기는 어렵습니다. 본 환자에서 관찰된 변이와 LHON과의 질병연관성 여부의 명확한 규명을 위해 가족검사를 통한 유전형-표현형 분석이 도움이 될 수 있으므로 환자의 가족검사를 추천합니다.",0
18,SEQ,LPE481,"TGFBI 유전자분석 결과, exon 4, 11, 12, 14에서 corneal dystrophy와 관련된 돌연변이는 관찰되지 않았습니다.",0
19,SEQ,LPE481,"TGFBI 유전자에 대한 direct sequencing 결과, Pathogenic 로 분류되는 c.371G>A, p.(Arg124His) 변이가 Heterozygous로 관찰되었습니다.",0
20,Genetic,LPE454,"상기 변이의 보다 명확한 임상적 의의 규명을 위해 임상양상을 확인하시기 바라며, 가족구성원 간의 segregation study에서 무증상 부모에서 새로이 발생한 de novo변이로 분류될 경우 해석에 도움이 될 수 있으므로 환자의 가족검사를 추천합니다.",2
23,SEQ,LPE245,"본 환자에서 NF1 유전자에 대한 검사결과, Pathogenic로 분류되는 기보고된 c.4236A>T, p.(Arg1412Ser) 변이가 Heterozygous로 관찰되었습니다. ",3
25,SEQ,LPE245,"본 환자에서 NF1 유전자에 대한 검사 결과, 질환 관련 돌연변이는 관찰되지 않았습니다. 본 검사는 RNA와 DNA를 모두 분석하게 되므로 검체의 상태가 결과에 영향을 줄 수 있습니다. 임상증상이 확실한 환자의 경우, 재채혈을 통한 재검사 및 segregation analysis를 위한 가족검사를 의뢰하시기 바랍니다.
",4
27,SEQ,LPE469,"
본 환자에서 TTR 유전자에 대한 direct sequencing 결과, 질환 관련 돌연변이는 관찰되지 않았습니다.
",0
28,MLPA,LPE232,"DMD 유전자에 대한 MLPA 분석결과, 질환과 관련된 DMD 유전자 결실/중복은 관찰되지 않습니다.
임상적으로 듀센형 근이영양증이 강하게 의심되나 본 검사에서 음성인 경우, DMD 직접염기서열검사 [LPE420]을 처방해서 확인하시기 바랍니다.",0
29,SEQ,LPE194,"본 환자에서 VHL 유전자에 대한 direct sequencing 결과, 질환 관련 돌연변이는 관찰되지 않았습니다. 
임상적으로 해당 질환이 강하게 의심되나 본 검사에서 음성인 경우, VHL gene MLPA test [LPE369]을 처방해서 확인하시기 바랍니다.",0
30,MLPA,LPE369,"VHL 유전자에 대한 MLPA 분석결과, 질환과 관련된 VHL 유전자 결실/중복은 관찰되지 않습니다.",0
31,SEQ,LPE287,"본 환자에서 RET 유전자에 대한 direct sequencing 결과, 질환 관련 돌연변이는 관찰되지 않았습니다.",0
32,Genetic,,"일반적으로 단일 유전자 질환의 경우 돌연변이의 침투율이 높다고 보고되어 있으나, 유전자 및 질환마다 침투율(penetrance)과 표현도(expressivity)가 다양할 수 있으므로, 임상양상과 관련하여 해석하시기 바랍니다.",11
33,Genetic,,"일반적으로 상염색체 열성 질환의 경우 두 개의 대립 유전자에 모두 이상이 있을 때 이환되고, 대립 유전자 하나에만 이상이 있을 시 이환되지 않습니다. 단, 본 검사로 검출되지 않는 큰 결실 및 중복, deep intron 돌연변이 등을 동반할 가능성을 배제할 수 없으므로, 임상 양상과 관련하여 해석하시기 바랍니다.",3
36,Genetic,,"또한 copy number alteration, structural variation, non-coding region의 돌연변이 등을 확인 하기 위해서는 Whole genome sequencing이 도움이 되므로, 필요시 진단검사의학과 전문의에게 의뢰주시기 바랍니다. ",32
37,Genetic,,"부수적으로, COL4A5 유전자에서 Likely Pathogenic로 분류되는 c.674C>T, p.(Pro225Leu) 변이가 Heterozygous로 관찰되었습니다. 다만, 본 유전자의 incomplete penetrance로 알려져 있으므로 임상 양상과 관련하여 해석하시기 바랍니다.",29
38,SEQ,LPC100,"본 환자에서 BRCA1 유전자에 대한 sequencing 결과, Pathogenic 으로 분류되는 c.3296del, p.(Pro1099Leufs*10) 변이가 Heterozygous로 관찰되었습니다. 환자의 가족에서 BRCA1 부분검사를 추천합니다.
또한, VUS (Variant of Unknown Significance) 로 분류되는 c.-92G>C 변이가 Heterozygous로 관찰되었습니다. 상기 변이는 population database에서 다음의 빈도로 보고되었습니다 (0.0005 in KRGDB). 해당 변이는 transcription regulation에 영향을 줄 수 있는 non-coding region promoter에 위치합니다. 상기 변이는 염기변이 해석에 관한 ACMG 가이드라인에 따라 (PMID: 25741868), 5 단계 염기변이 분류 기준 중 VUS에 해당합니다. 상기 변이의 보다 명확한 임상적 의의 규명을 위해 임상양상을 확인하시기 바라며 가족구성원 간의 segregation study 가 도움이 될 수 있으므로 환자의 가족검사를 추천합니다. ",16
39,SEQ,LPC101,"본 환자에서 BRCA1 유전자에 대한 sequencing 결과, Pathogenic 으로 분류되는 c.3296del, p.(Pro1099Leufs*10) 변이가 Heterozygous로 관찰되었습니다. 환자의 가족에서 BRCA1 부분검사를 추천합니다.
또한, VUS (Variant of Unknown Significance) 로 분류되는 c.-92G>C 변이가 Heterozygous로 관찰되었습니다. 상기 변이는 population database에서 다음의 빈도로 보고되었습니다 (0.0005 in KRGDB). 해당 변이는 transcription regulation에 영향을 줄 수 있는 non-coding region promoter에 위치합니다. 상기 변이는 염기변이 해석에 관한 ACMG 가이드라인에 따라 (PMID: 25741868), 5 단계 염기변이 분류 기준 중 VUS에 해당합니다. 상기 변이의 보다 명확한 임상적 의의 규명을 위해 임상양상을 확인하시기 바라며 가족구성원 간의 segregation study 가 도움이 될 수 있으므로 환자의 가족검사를 추천합니다. ",15
40,SEQ,LPE245," 본 환자에서 NF1 유전자에 대한 검사결과, VUS (Variant of Unknown Significance) 로 분류되는 기보고된 c.5711A>C, p.(Asn1904Thr) 변이가 Heterozygous로 관찰되었습니다. 이 변이는 population database에서 0.0024(Korean KRGDB)와 0.000027(Global)의 빈도로 보고된 바 있습니다. 다수의 컴퓨터 기반 알고리즘분석에서 유전자의 기능에 손상을 주는것으로 예측됩니다. (BayesDel_addAF, DANN, DEOGEN2, EIGEN, FATHMM-MKL, LIST-S2, M-CAP, MutationTaster, PrimateAI and SIFT). 위 근거들을 종합하면 상기 변이는 염기변이 해석에 관한 ACMG 가이드라인에 따라 (PMID: 25741868), 5 단계 염기변이 분류 기준 중 VUS에 해당합니다. 상기 변이의 보다 명확한 임상적 의의 규명을 위해 임상양상을 확인하시기 바라며 가족구성원 간의 segregation study 가 도움이 될 수 있으므로 환자의 가족검사를 추천합니다. 추가 검사 결과에 따라 변이의 최종분류 해석은 달라질 수 있습니다.",5
41,SEQ,LPE262,"본 환자에서 APC 유전자에 대한 direct sequencing 결과, 질환 관련 돌연변이는 관찰되지 않았습니다.",1
42,SEQ,LPE262,가족성 선종성 용종증은 상염색체 우성 유전질환으로 환자의 75%-85%에서 이환된 부모의 가족력이 있습니다. 환자의 가족검사를 추천합니다.,3
43,SEQ,LPE262,"본 환자에서 APC 유전자에 대한 direct sequencing 결과, Pathogenic VUS (Variant of Unknown Significance) 로 분류되는 c.000, p.(00) 변이가 Heterozygous로 관찰되었습니다. ",2
44,SEQ,LPE262,"이 변이는 mRNA splicing 에서 중요한 위치(canonical ±1또는 ±2 splice site)에 위치하고 있습니다. ",4
45,SEQ,LPE295,"TARGET DISEASE: Acute myeloid leukemia (AML)
SPECIMEN: Genomic DNA isolated from bone marrow leukocytes-adequate specimen 
ANALYZED GENE: TP53 on 17p13.1
METHOD: *Direct sequencing for whole exons including intron-exon boundaries
",2
46,SEQ,LPE295,"*Sequencing has an analytical sensitivity of approximately 99% for the detection of nucleotide base alterations, small deletions and insertions, but it does not detect large deletions. Low-level mosaicism will not be detected by routine sequencing methodologies. Only the coding and immediate flanking regions of genes are analyzed, new splice sites, changes in the promoter region, and other non-coding or regulatory region will not be detected.",3
47,SEQ,LPE295,"TP53 유전자 분석결과, 급성골수백혈병의 불량한 예후와 관련된 돌연변이는 검출되지 않았습니다. ",4
48,SEQ,LPE295,"TP53 유전자의 돌연변이는 전체 AML의 약 1-2%에서 관찰되며, 특히 therapy-related AML 또는 complex karyotype을 동반한 AML에서 높은 빈도(53-70%)로 보고되고 있습니다. AML에서의 TP53 돌연변이는 주로 exon 4부터 8까지 분포하고 있으며, 대부분 missense mutation이나 premature stop codon을 유발하는 frame shifting mutation, nonsense mutation도 관찰됩니다. 현재까지 보고된 다수의 연구에 따르면, TP53 유전자의 돌연변이를 동반한 AML은 불량한 생존을 보이는 것으로 알려져 있습니다(Blood. 2012 Mar 1;119(9):2114-21; Blood Cancer J. 2015 Jul 31;5:e331). ",5
49,SEQ,LPE295,본 검사는 TP53 유전자의 coding exon 및 인접 intron 부위의 염기서열을 직접염기서열분석법으로 확인하는 검사입니다.,6
50,SEQ,LPE360,"TARGET DISEASE: Acute myeloid leukemia (AML), Myelodysplastic syndromes (MDS)
SPECIMEN: Genomic DNA isolated from peripheral blood leukocytes-adequate specimen 
ANALYZED GENE: DNMT3A on 2p23
METHOD: *Direct sequencing for whole exons including intron-exon boundaries
",0
51,SEQ,LPE360,"***DNMT3A 유전자 변이는 NM_022552.4 reference sequence를 기준으로 기술하였습니다.
*Sequencing has an analytical sensitivity of approximately 99% for the detection of nucleotide base alterations, small deletions and insertions, but it does not detect large deletions. Low-level mosaicism will not be detected by routine sequencing methodologies. Only the coding and immediate flanking regions of genes are analyzed, new splice sites, changes in the promoter region, and other non-coding or regulatory region will not be detected.
",0
52,SEQ,LPE360,"DNMT3A 유전자 분석결과, Exon14에서 급성골수성백혈병 또는 골수이형성증후군의 불량한 예후와 관련된 missense mutation p.(Arg882Cys)이 이형접합의 형태로 검출되었습니다",0
53,SEQ,LPE360,"DNMT3A 유전자 돌연변이는 AML의 12-35%에서 관찰되며, 돌연변이의 약 50%는 DNMT3A 단백질의 carboxyl 말단 부위인 Arg882 위치에서 발생하는 것으로 보고되고 있습니다. 현재까지 보고된 다수의 연구에 따르면 DNMT3A 돌연변이를 동반한 AML의 경우 불량한 생존을 보이는 것으로 알려져 있습니다 (AP Im et al., Leukemia 2014; 28:1774–1783).",0
54,SEQ,LPE360,"MDS에서의 DNMT3A 돌연변이는 약 8%에서 관찰되며 주로 nonsense 또는 missense mutation의 형태로 검출됩니다. DNMT3A 돌연변이는 blast count와는 큰 연관이 없으며, MDS의 초기 병인에 관여합니다. DNMT3A 돌연변이를 동반한 MDS의 경우 AML로의 조기 이행이 발생할 수 있고, 불량한 생존을 보이므로, DNMT3A 유전자의 돌연변이 여부를 확인하여 적극적인 치료를 시행할 필요가 있습니다 (Leukemia. 2011 Jul; 25(7):1153-8.).",0
55,SEQ,LPE360,"본 검사는 reference sequence NM_022552.4 를 기준으로 DNMT3A 유전자의 coding exon 및 인접 flanking region을 직접염기서열법으로 분석하는 방법입니다. ",0
56,SEQ,LPE156,"MYD88 유전자 분석결과, B cell lymphoma의 병인과 관련된 변이는 관찰되지 않았습니다.",0
57,SEQ,LPE156,"본 환자에서 MYD88 유전자에 대한 sequencing 결과, 질환 관련 돌연변이는 관찰되지 않았습니다.",0
58,SEQ,LPE227,"본 환자에서  CYP21A2에 대한 direct sequencing 결과, 질환 관련 돌연변이는 관찰되지 않았습니다.",1
59,SEQ,LPE227,"선천성부신증식증과 같은 상염색체 열성질환의 경우, 환자가 실제 이형접합인 경우에도 allele drop이나 heterozygous deletion 등의 원인으로 동형접합과 같은 결과를 보일 수 있습니다. 따라서 정확한 접합성 평가를 위해서는 부모 두 분의 가족검사가 권고됩니다.(Megan L.(2012) Genet Med 2012:14(10):877-882)",3
60,SEQ,LPE227,"임상적으로 의심될 경우 정확한 진단을 위해서, 위 변이와 Copy number variation의 compound heterozygotes 여부에 대한 감별이 필요합니다. Gene deletion/duplication 확인을 위해 CYP21A2 MLPA 검사(LPE332)를 의뢰하시기 바랍니다.",4
61,SEQ,LPE227,"CYP21A2 유전자 검사를 시행한 결과, 보고된 21-hydroxylase deficiency(21-OHD)의 원인돌연변이인 c.293-13C>G가 이형접합의 형태로 관찰되었습니다(Proc Natl Acad Sci U S A. 1988;85(20):7486-90). 상기 c.293-13C>G 변이는 splicing error를 유발하며 선천성부신증식증(congenital adrenal hyperplasia, CAH) 중 salt-wasting form과 simple virilizing form 모두에서 관찰되는 것으로 알려져 있습니다. ",5
62,SEQ,LPE227,"CYP21A2 유전자 검사를 시행한 결과, 보고된 21-hydroxylase deficiency(21-OHD)의 원인돌연변이인 c.293-13C>G과 c.1069C>T (p.Arg357Trp, also known as R356W)가 관찰되었습니다.  상기 c.293-13C>G 변이는 splicing에 문제를 일으켜 truncated small or unusual protein를 만들며, classic form에서 자주 관찰되는 것으로 알려져 있습니다. c.1069C>T 변이는 다른 변이와 복합이형접합자 (compound heterozygosity)로 동반될 경우 simple virilizing CAH를 유발하는 것으로 알려져 있습니다. ",6
63,SEQ,LPE227,"임상적으로 해당 질환이 강하게 의심되나 본 검사에서 음성인 경우, 전체 돌연변이의 약 20-30%를 차지하는 Gene deletion/duplication 의 확인을 위해 CYP21A2 MLPA 검사(LPE332)를 추천합니다.",2
64,SEQ,LPC101,"환자 가족에 대한 추가 검사 및 유전상담이 유전적 변이의 의의 판정과 위험군의 조기진단에 유용하므로 환자의 가족검사를 추천합니다. ",1
66,SEQ,LPC100,"환자 가족에 대한 추가 검사 및 유전상담이 유전적 변이의 의의 판정과 위험군의 조기진단에 유용하므로 환자의 가족검사를 추천합니다. ",1
68,SEQ,LPE245,"본 환자에서 NF1 유전자에 대한 direct sequencing 결과, Likely Pathogenic로 분류되는 c.4027A>C, p.(Thr1343Pro) 변이가 Heterozygous로 관찰되었습니다. 이 변이는 다른 문헌에서 병원성으로 보고된 바 있습니다 (PubMed: 25074460). 해당 변이는 population database에서 보고된 바 없으며, 다수의 컴퓨터 기반 알고리즘분석에서 유전자의 기능에 손상을 주는것으로 예측됩니다. (11 pathogenic predictions from BayesDel_addAF, DANN, DEOGEN2, EIGEN, FATHMM-MKL, LIST-S2, M-CAP, MVP, MutationAssessor, MutationTaster and SIFT vs 1 benign prediction from PrimateAI). 위 근거들을 종합하면 상기 변이는 염기변이 해석에 관한 ACMG 가이드라인에 따라 (PMID: 25741868), 5 단계 염기변이 분류 기준 중 Likely Pathogenic에 해당합니다. 상기 변이의 보다 명확한 임상적 의의 규명을 위해 임상양상을 확인하시기 바라며, 필요시 가족구성원 간의 segregation study 가 도움이 될 수 있으므로 환자의 가족검사를 추천합니다. 추가 검사 결과에 따라 변이의 최종분류 해석은 달라질 수 있습니다.",6
70,SEQ,LPE245,"본 환자에서 NF1 유전자에 대한 direct sequencing 결과, Pathogenic로 분류되는 c.7970+4_7970+7del, Exon 54 skipping (r.7870_7970del) 변이가 Heterozygous로 관찰되었습니다. 이 변이는 population database (gnomAD v2.1.1)에 보고된 바 없는 변이로, 문헌에서 상기 변이로 인해 Exon 54 skipping이 발생하여 병원성으로 보고된 바 있습니다 (PMID: 32575496). 이 변이는 컴퓨터 기반 알고리즘에서 aberrant splicing을 일으키는 것으로 예측되며, cDNA 염기서열분석 결과 Exon 54 skipping (r.7870_7970del)을 보이는 aberrant transcript가 관찰되었습니다. 위 근거들을 종합하면 상기 변이는 염기변이 해석에 관한 ACMG 가이드라인에 따라 (PMID: 25741868), 5 단계 염기변이 분류 기준 중 pathogenic에 해당합니다. 환자 가족에 대한 추가 검사 및 유전상담이 유전적 변이의 의의 판정과 위험군의 조기진단에 유용하므로 환자의 가족검사를 추천합니다.",7
71,SEQ,LPE420,"임상적으로 듀센형 근이영양증이 강하게 의심되나 본 검사에서 음성인 경우, DMD Multiplex Ligation-dependent Probe Amplification (MLPA) [LPE232]을 처방해서 확인하시기 바랍니다.",0
72,SEQ,LPC100," 상기 변이는 population database에서 다음과 같이 낮은 빈도로 보고되었습니다 (0.000004 in gnomAD-Global). 해당 변이는 exon/intron 경계에서 8번째에 위치하고 있으며, HGMD의 한 문헌(PubMed:27062684)에는 VUS로, 다른 ClinVar보고(RCV000638000.1, RCV000776352.1)에서는 likely benign으로 보고된 바 있습니다. 상기 변이는 염기변이 해석에 관한 ACMG 가이드라인에 따라 (PMID: 25741868), 5 단계 염기변이 분류 기준 중 VUS에 해당합니다. 상기 변이의 보다 명확한 임상적 의의 규명을 위해 임상양상을 확인하시기 바라며 가족구성원 간의 segregation study 가 도움이 될 수 있으므로 환자의 가족검사를 추천합니다. ",6
73,SEQ,LPC101," 상기 변이는 population database에서 다음과 같이 낮은 빈도로 보고되었습니다 (0.000004 in gnomAD-Global). 해당 변이는 exon/intron 경계에서 8번째에 위치하고 있으며, HGMD의 한 문헌(PubMed:27062684)에는 VUS로, 다른 ClinVar보고(RCV000638000.1, RCV000776352.1)에서는 likely benign으로 보고된 바 있습니다. 상기 변이는 염기변이 해석에 관한 ACMG 가이드라인에 따라 (PMID: 25741868), 5 단계 염기변이 분류 기준 중 VUS에 해당합니다. 상기 변이의 보다 명확한 임상적 의의 규명을 위해 임상양상을 확인하시기 바라며 가족구성원 간의 segregation study 가 도움이 될 수 있으므로 환자의 가족검사를 추천합니다. ",13
74,MLPA,LPE322,"환자에서 질환과 관련된 SMN1 유전자의 exon7 결실은 관찰되지 않습니다. ",1
75,MLPA,LPE322,"본 환자에서 관찰되는 SMN2 exon7, exon8의 결실(copy number 1)은 한국인을 대상으로 한 연구에 따르면 정상인의 약 24.7%에서 발견되는 copy number variation입니다 (Ann Lab Med 2020; 40(4): 326-330).",4
76,SEQ,LPE245,"본 환자에서 NF1 유전자에 대한 direct sequencing 결과, VUS (Variant of Unknown Significance)로 분류되는 c.5609+3A>C, p.? 변이가 Heterozygous로 관찰되었습니다. 이 변이는 기존에 보고된 바 없으며, population database에서도 보고된 바 없습니다. 상기 변이는 염기변이 해석에 관한 ACMG 가이드라인에 따라 (PMID: 25741868), 5 단계 염기변이 분류 기준 중 VUS에 해당합니다. 변이의 보다 명확한 임상적 의의 규명을 위해 가족구성원 간의 segregation study 가 도움이 될 수 있으므로 환자의 가족검사를 추천합니다. 해당 변이가 추가 검사로 De novo변이로 확인될 경우 변이의 최종분류 해석은 달라질 수 있습니다. ",8
77,SEQ,LPC100,"본 환자에서 BRCA2 유전자에 대한 direct sequencing 결과, VUS (Variant of Unknown Significance)로 분류되는 c.10221del, p.(Asn3407Lysfs*20) 변이가 Heterozygous로 관찰되었습니다. 상기 변이는 population database에서 보고된 적 없는 frameshifting deletion mutation로 exon 27 아미노산 서열의 truncation을 일으키지만, 마지막 exon부분의 truncation은 임상적 중요성이 줄어듭니다 (Genet Med. 2019;21(2):293-302. PMID: 29988080), (Nat Genet. 1996;14(3):253-4. PMID: 8896551). 따라서 상기 변이는 염기변이 해석에 관한 ACMG 가이드라인(PMID: 25741868)과 PVS1 recommendation (PMID: 30192042)에 따라, 5 단계 염기변이 분류 기준 중 VUS에 해당합니다. 상기 변이의 보다 명확한 임상적 의의 규명을 위해 임상양상을 확인하시기 바라며, 가족구성원 간의 segregation study 가 도움이 될 수 있으므로, 환자의 가족검사를 추천합니다. 같은 표현형의 가족에서 추가 검사 결과에 따라 변이의 최종분류 해석은 달라질 수 있습니다.",7
