id,type,code,comment,seq
111,SEQ,LPE243,"본 환자에서 NOTCH3 유전자에 대한 direct sequencing 결과, Likely Pathogenic로 분류되는 c.3356G>A, p.Cys1119Tyr 변이가 Heterozygous로 관찰되었습니다. 이 변이는 gnomAD population database에서 0.000007(Global)의 빈도로 보고된 바 있습니다. 해당 변이는 다른 병원성 변이와 유사하게 EGF-like domain에서 Cysteine residue를 변형시키는 변이입니다. 또한, 다수의 컴퓨터 기반 in silico분석에서 유전자의 기능에 손상을 주는것으로 예측됩니다. 다른 문헌에서는 Likely pathogenic (PMID: 31719132)과 VUS (PMID: 24139282)로 각각 보고된 바 있습니다. 따라서 상기 변이는 염기변이 해석에 관한 ACMG 가이드라인(PMID: 25741868)에 따라, 5 단계 염기변이 분류 기준 중 Likely pathogenic에 해당합니다.  상기 변이의 보다 명확한 임상적 의의 규명을 위해 임상양상을 확인하시기 바라며, 가족구성원 간의 segregation study 가 도움이 될 수 있으므로, 환자의 가족검사를 추천합니다. 같은 표현형의 가족에서 추가 검사 결과에 따라 변이의 최종분류 해석은 달라질 수 있습니다.",0
112,SEQ,LPE245,"본 환자에서 NF1 유전자에 대한 sequencing 결과, small intraexonic mutation 은 관찰되지 않았습니다. NF1 유전자의 single 혹은 multi-exon deletion을 검출하기 위해 추가적으로 MLPA 검사를 처방한 경우, MLPA 결과보고를 확인하시기 바랍니다. NF1 유전자의 whole gene deletion이 이형접합의 형태로 관찰되었습니다.",13
113,SEQ,LPE295,"유전성 목적일때 아래로 변경
Target Disease
Li-Fraumeni syndrome

일반코멘트1
Li-Fraumeni 증후군은 sarcoma, breast cancer, leukemia, brain tumor, adrenocortical carcinoma 등의 종양이 조기에 발생하는 상염색체우성 유전양상의 암 유발 증후군입니다. 암 억제유전자인 TP53의 germline mutation이 주요 원인인 것으로 알려져 있습니다. TP53 유전자에 의해 encoding되는 tumor protein p53은 cell cycle arrest, apoptosis, senescence, DNA 복구 또는 변화를 유도하는 target gene을 조절하는 등 다양한 cellular stress에 반응합니다. P53 protein은 정상 세포에는 낮은 농도로 발현되지만 transformation과 malignancy에서는 높은 농도로 발현됩니다.",1
114,MLPA,LPE322,"또한, SMN1 exon 8 (복제수 1) 이 SMN2 exon 8 (복제수 3)로 관찰되어 hybrid SMN gene이 있는것으로 의심되나, Spinal Muscular Atrophy 질병과 연관되지는 않습니다.",10
115,SEQ,LPC101,"본 환자에서 BRCA2 유전자에 대한 sequencing 결과, VUS (Variant of Unknown Significance) 로 분류되는 c.10150C>T, p.(Arg3384*) 변이가 Heterozygous로 관찰되었습니다. 상기 변이는 population database에서 다음의 빈도로 보고되었으며 (0.0005241 in Korean), nonsense null variant로 아미노산 서열의 truncation을 일으키지만, 마지막 exon부분의 truncation은 임상적 중요성이 줄어듭니다 (Genet Med. 2019;21(2):293-302. PMID: 29988080), (Nat Genet. 1996;14(3):253-4. PMID: 8896551). 따라서, 상기 변이는 염기변이 해석에 관한 ACMG 가이드라인(PMID: 25741868)과 PVS1 criterion (PMID: 30192042)에 따라, 5 단계 염기변이 분류 기준 중 VUS에 해당합니다. 상기 변이의 보다 명확한 임상적 의의 규명을 위해 임상양상을 확인하시기 바라며, 필요시 가족구성원 간의 segregation study 가 도움이 될 수 있으므로 환자의 가족검사를 추천합니다. 추가 검사 결과에 따라 변이의 최종분류 해석은 달라질 수 있습니다.",7
116,SEQ,LPE302,"MT-ND1, MT-ND4, MT-ND6, MT-CYB 유전자 분석결과, Leber’s Hereditary Optic Neuropathy(LHON) 관련된 것으로 보고된 m.14484T>C가 Homoplasmy형태로 관찰되었습니다.",0
117,SEQ,LPE141,"본 환자에서 FBN1 유전자에 대한 sequencing 결과, Pathogenic로 분류되는 c.7606G>A, p.(Gly2536Arg) 변이가 Heterozygous로 관찰되었습니다. 해당 변이는 기보고된 missense 변이이며 (PMID:11524736‚ 11748851‚ 27611364, 33059708, 34498425), Functional study에서 aberrant splicing을 일으키는 변이로 보고된 바 있습니다 (PubMed: 21895641, 32123317).  상기 변이는 population database에서 보고된 바 없으며, 다수의 컴퓨터 기반 알고리즘분석에서는 유전자의 기능에 손상을 주는 것으로 예측됩니다. 상기 변이는 염기변이 해석에 관한 ACMG 가이드라인에 따라 (PMID: 25741868), 5 단계 염기변이 분류 기준 중 Pathogenic에 해당합니다. ",0
118,SEQ,LPE245,"또한, 추가로 시행한 cDNA 염기서열분석에서도 aberrant transcript는 관찰되지 않았습니다.",1
119,SEQ,LPE360," 본 환자에서 DNMT3A에 대한 direct sequencing 결과, 질환 관련 돌연변이는 관찰되지 않았습니다.",0
120,Genetic,,"유전자 및 질환마다 침투율(penetrance)과 표현도(expressivity)가 다양할 수 있으므로, 임상양상과 관련하여 해석하시기 바라며, 필요한 경우 관련 가족검사와 유전상담을 권고드립니다.",1
121,SEQ,LPE302,"MT-ND1, MT-ND4, MT-ND6, MT-CYB 유전자 분석결과, Leber’s Hereditary Optic Neuropathy(LHON) 관련된 것으로 보고된 m.11778G>A가 Homoplasmy형태로 관찰되었습니다.",0
122,SEQ,LPE245,이 변이는 다른 문헌에서 병원성으로 보고된 바 있습니다 (PubMed: ### ).,14
123,Genetic,,이 변이는 다른 문헌에서 병원성으로 보고된 바 있습니다 (PubMed: ### ).,23
124,Genetic,,**********과 관련하여 참고하시기 바랍니다 (https://www.ncbi.nlm.nih.gov/books/******/).,9
125,Genetic,,"이 변이는 틀이동 변이로 null variant이며, population database에서는 보고된 바 없습니다. 위 근거들을 종합하면 상기 변이는 염기변이 해석에 관한 ACMG 가이드라인에 따라 (PMID: 25741868), 5 단계 염기변이 분류 기준 중 Likely pathogenic 에 해당합니다. 상기 변이의 보다 명확한 임상적 의의 규명을 위해 임상양상을 확인하시기 바라며 가족구성원 간의 segregation study 가 도움이 될 수 있으므로 환자의 가족검사를 추천합니다. 추가 검사 결과에 따라 변이의 최종분류 해석은 달라질 수 있습니다.",28
126,Genetic,,"상기 변이는 population database에서 다음과 같은 빈도로 보고되었습니다 (0.0005 in KRGDB, 0.000012 in gnomAD-Global). 다수의 컴퓨터 기반 알고리즘분석에서 유전자의 기능에 손상을 주는것으로 예측됩니다. 위 근거들을 종합하면 상기 변이는 염기변이 해석에 관한 ACMG 가이드라인에 따라 (PMID: 25741868), 5 단계 염기변이 분류 기준 중 VUS에 해당합니다. 상기 변이의 보다 명확한 임상적 의의 규명을 위해 임상양상을 확인하시기 바라며 가족구성원 간의 segregation study 가 도움이 될 수 있으므로 환자의 가족검사를 추천합니다. 추가 검사 결과에 따라 변이의 최종분류 해석은 달라질 수 있습니다.",27
127,SEQ,LPE494,"검사실에서 추가적으로 시행한, CFH유전자의 MLPA 분석에서도 copy number variation은 관찰되지 않았습니다.",0
128,Genetic,,"[가족검사에 의한 추가수정보고 2023-03-22] 추가적으로 진행한 가족검사 결과, 환자 검체에서
확인되었던 RAI1 유전자의 c.817C>T 변이가 환자의 모친 검체에서도 이형접합 형태로 확인되
었습니다. 해당 변이가 환자의 증상의 원인일 가능성은 낮을 것으로 판단됩니다.",21
129,Genetic,,"상기 변이는 문헌에 보고된 1예가 있으며 (PMID: 26632257), population database에서는 보고된 바 없습니다. 해당 위치는 돌연변이가 자주 보고되는 부위에 속하며, 같은 아미노산 위치에서 다른 종류의 아미노산 단백 변화변이가 보고된 바 있습니다 (Asn3188Ile, Asn3188Ser, Asn3188Thr). 컴퓨터 기반 알고리즘분석에서 유전자의 기능에 손상을 주는것으로 예측됩니다. 위 근거들을 종합하면 상기 변이는 염기변이 해석에 관한 ACMG 가이드라인에 따라 (PMID: 25741868), 5 단계 염기변이 분류 기준 중 Likely Pathogenic에 해당합니다.",26
130,SEQ,LPE494,"본 환자에서 CFH 유전자에 대한 검사 결과, Heterozygous deletion in Exon 22 and downstream가 관찰되었습니다. 이는 CFH-CFHRs genetic abnormalities의 결과로 생각되며, 이와 관련되어 여러 문헌이 보고되어 있습니다 (J Am Soc Nephrol. 2016;27(6):1617-24. J Am Soc Nephrol. 2018;29(1):240-249. J Am Soc Nephrol. 2015;26(1):209-19. Kidney Int. 2017;92(4):876-887. Pediatr Nephrol. 2013;28(11):2221-5.).",0
131,SEQ,LPE494,"CFH변이에 의한 aHUS 중에서 3~5%에서 발견되는 deletion/duplication변이와 CFH/CFHR1 hybrid allele에 의한 genetic abnormality는 본 검사법으로는 검출할 수 없습니다. CFH, CFHRs에 대한 MLPA 검사가 필요한 경우 유전진단검사센터로 의뢰하시기 바랍니다.",0
132,SEQ,LPE494,"추가적으로 시행한 CFH유전자의 MLPA 분석에서, CFHR3/CFHR1 deletion이 Heterozygous로 관찰되었습니다. 이는 General population에서 25~30%의 allele frequency로 관찰되는 변이 입니다. CFHR3/CFHR1 deletion이 Homozygous인 경우, aHUS의 위험도와 연관되는 것으로 알려져 있습니다.",0
133,Genetic,,"본 환자에서 Connective tissue disorder (60 genes) 에 대한 targeted panel sequencing 결과, 질환 관련 돌연변이는 관찰되지 않았습니다. 이는 Marfan 증후군과 관련된 FBN1 유전자에서도 질환과 관련된 돌연변이가 발견되지 않았음을 의미합니다. 과거 연구에서는 FBN1-Related Marfan 증후군에서 sequence analysis 방법으로 약 90-93%의 변이를, gene-targeted deletion/duplication analysis 방법으로 약 5%의 변이를 발견했습니다. 만약 Marfan 증후군이 강하게 의심되어 deletion/duplication을 확인해야 한다면, 진단검사의학과로 의뢰주시기 바랍니다.",24
134,Genetic,,"유전성 암 증후군의 일부에서는 deletion/duplication 변이가 원인인 경우가 있으므로 (e.g. Lynch syndrome의 MLH1 10-20%, MSH2 20-40%, MSH6 0-10%, PMS2 20-55%, EPCAM 100%), 임상적으로 deletion/duplication 확인이 필요한 경우, 진단검사의학과로 의뢰주시기 바랍니다.",25
135,SEQ,LPC100,"본 환자에서 BRCA2 유전자에 대한 direct sequencing 결과, Likely Pathogenic로 분류되는 c.7868A>G, p.(His2623Arg) 변이가 Heterozygous로 관찰되었습니다. 상기 변이는 population database에서 다음과 같이 낮은 빈도로 보고되었습니다 (0.00004 in gnomAD-Global). 변이는 자주 돌연변이가 보고되는 부위로 기능이 잘 규명된 위치에 있으며, 같은 아미노산 위치에서 다른 종류의 아미노산 단백 변화변이가 보고된바 있습니다 (His2623Tyr). 또한, 컴퓨터 기반 알고리즘분석에서 유전자의 기능에 손상을 주는 것으로 예측되며, 다수의 기관에서 ClinVar에 Likely pathogenic으로 보고된 바 있습니다. 위 근거들을 종합하면 상기 변이는 염기변이 해석에 관한 ACMG 가이드라인에 따라 (PMID: 25741868), 5 단계 염기변이 분류 기준 중 Likely Pathogenic 에 해당합니다. 상기 변이의 보다 명확한 임상적 의의 규명을 위해 임상양상을 확인하시기 바라며 가족구성원 간의 segregation study 가 도움이 될 수 있으므로 환자의 가족검사를 추천합니다. 추가 검사 결과에 따라 변이의 최종분류 해석은 달라질 수 있습니다.",5
136,SEQ,LPC101,"본 환자에서 BRCA2 유전자에 대한 direct sequencing 결과, Likely Pathogenic로 분류되는 c.7868A>G, p.(His2623Arg) 변이가 Heterozygous로 관찰되었습니다. 상기 변이는 population database에서 다음과 같이 낮은 빈도로 보고되었습니다 (0.00004 in gnomAD-Global). 변이는 자주 돌연변이가 보고되는 부위로 기능이 잘 규명된 위치에 있으며, 같은 아미노산 위치에서 다른 종류의 아미노산 단백 변화변이가 보고된바 있습니다 (His2623Tyr). 또한, 컴퓨터 기반 알고리즘분석에서 유전자의 기능에 손상을 주는 것으로 예측되며, 다수의 기관에서 ClinVar에 Likely pathogenic으로 보고된 바 있습니다. 위 근거들을 종합하면 상기 변이는 염기변이 해석에 관한 ACMG 가이드라인에 따라 (PMID: 25741868), 5 단계 염기변이 분류 기준 중 Likely Pathogenic 에 해당합니다. 상기 변이의 보다 명확한 임상적 의의 규명을 위해 임상양상을 확인하시기 바라며 가족구성원 간의 segregation study 가 도움이 될 수 있으므로 환자의 가족검사를 추천합니다. 추가 검사 결과에 따라 변이의 최종분류 해석은 달라질 수 있습니다.",8
137,Genetic,,"환자가 allo-PBSCT를 시행하였으므로, Buccal specimen을 이용하여 검사 진행한 결과입니다.",5
138,SEQ,LPE245,"이 변이는 mRNA splicing 에서 중요한 위치(canonical ±1또는 ±2 splice site)에 위치하고 있으며, cDNA 염기서열분석 결과 aberrant transcript가 관찰되었습니다. HGMD에서 2예 보고된 바 있습니다 (CS183883, PMID: 29618358, 30602027).",15
139,SEQ,LPE245,"Arrhythmogenic Right Ventricular Cardiomyopathy(ARVC)과 관련되는 PKP2, DSG2, DSP, DSC2, JUP, TMEM43, DES, PLN에서 유의미한 small intraexonic mutation 은 관찰되지 않았습니다. 임상 양상과 관련하여 해석하시기 바라며, ARVC의 일부에서는 결실이나 중복 변이가 원인인 경우가 있습니다. 결실 및 중복, deep intron 변이는 본 NGS검사로 검출되지 않으므로, MLPA 또는 Whole genome sequencing이 도움이 될 수 있습니다. ",16
140,Genetic,,"Arrhythmogenic Right Ventricular Cardiomyopathy(ARVC)과 관련되는 PKP2, DSG2, DSP, DSC2, JUP, TMEM43, DES, PLN에서 유의미한 small intraexonic mutation 은 관찰되지 않았습니다. 기존에 보고된 바에 따르면, 임상적으로 진단된 경우에도 약 50% 환자에서는 유전적 변이가 발견되지 않는다고 알려져 있습니다 (PMID: 23486541, 22889254). 단, ARVC의 일부(1-3%)에서는 deletion/duplication 변이가 원인으로 발견되는 경우도 있습니다. Deletion/duplication, deep intron 변이는 본 NGS검사로 검출되지 않으며, MLPA, Microarray, 또는 Whole genome sequencing 검사가 도움이 될 수 있습니다. ",22
141,SEQ,LPE141,"검사실에서 추가적으로 시행한, FBN1유전자의 MLPA 분석에서도 copy number variation은 관찰되지 않았습니다.",0
142,SEQ,LPE243,"본 환자에서 유전성 당뇨 (383 genes) 에 대한 targeted panel sequencing 결과, 유전성 당뇨와 관련된 질환 관련 변이는 관찰되지 않았습니다. 추가로, NOTCH3 유전자에서 Pathogenic로 분류되는 c.224G>C, p.(Arg75Pro) 변이가 Heterozygous로 관찰되었습니다. NOTCH3는 CADASIL에 관련된 유전자 이며 (https://www.ncbi.nlm.nih.gov/books/NBK1500/), NOTCH3 유전자의 전형적인 과오돌연변이는 NOTCH3 단백내 34개의 EGFr 도메인 내의 cysteine이 관여되는 변이입니다. 
본 환자에서 발견된 변이는 cysteine이 관여되지 않는 Atypical한 과오변이이나, 기능적 연구를 통해 유전자의 기능에 손상을 주는 것으로 입증된바 있으며 다른 문헌에서는 Pathogenic 또는 Likely pathogenic으로 보고된 바 있습니다. 그러나 Atypical변이의 경우 임상적 의의에 대한 신중한 해석을 권고하고 있습니다(Rutten JW et al., Expert Rev Mol Diagn. 2014). 임상증상이 CADASIL에 합당할 경우 피부생검으로 CADASIL에 전형적인 혈관벽의 이상이 관찰되는지 확진할 필요가 있습니다. 상기 변이의 보다 명확한 임상적 의의 규명을 위해 임상양상을 확인하시기 바랍니다. ",0
143,Genetic,,~와 관련되는 유전자에서 질환관련 변이는 관찰되지 않았습니다.,8
144,Genetic,,환자에서 관찰된 변이에 대해 가족에서 이환여부를 확인이 필요할 경우에는 [LPE155 유전성유전질환 Family] 검사를 추천드립니다.,20
145,Genetic,,"Secondary finding은 유전자검사를 의뢰한 환자의 주증상과 관련이 없더라도 Cancer, Cardiovascular, Metabolism 등과 관련된 71개의 유전자에서 Pathogenic 또는 Likely pathogenic 변이가 관찰된 경우를 말하며, 검사 의뢰시 환자 동의하에 보고됩니다.",18
146,Genetic,,"RYR1 유전자는 Malignant hyperthermia와 연관되며, 수술 및 시술 중에 사용되는 특정 흡입 마취제에 대한 심각한 부작용을 야기할 수 있는 것으로 알려져 있습니다.",19
147,MLPA,LPE232,"DMD 유전자에 대한 MLPA 분석결과, exon 3-17의 heterozygous deletion이 관찰되어 DMD/BMD의 보인자 (carrier)로 판단됩니다. 보인자인 여성의 경우, pathogenic allele이 자식에게 50%의 확률로 유전될 수 있으므로 이에 대한 유전상담이 필요합니다.  DMD 유전자는 X염색체에 있으므로 pathogenic allele을 받은 남아는 환자가 되며, 여아는 보인자가 됩니다. 여성 보인자 중 8-22%에서 증상을 일으킬 수 있는데(manifesting carrier), 좌심실 비대, 확장성 심근병증, 근육통, 근육경련, 근력저하 등의 다양한 증상이 보고되었습니다(Hoogerwaard EM, Lancet. 1999;353(9170):2116-9.). 한국인 manifesting carrier도 보고된 바 있습니다 (Song TJ. Yonsei Med J. 2011;52(1):192-5). ",0
148,MLPA,LPE322,"본 환자에서 관찰되는 SMN2 exon7, exon8의 복제수 증가(copy number 3)는 한국인을 대상으로 한 연구에 따르면 정상인의 약 5.8%에서 발견되는 copy number variation입니다 (Ann Lab Med 2020; 40(4): 326-330).",5
149,MLPA,LPE322,"본 환자에서 관찰되는 SMN2 exon7, exon8의 결실(copy number 0)은 한국인을 대상으로 한 연구에 따르면 정상인의 약 2.8%에서 발견되는 copy number variation입니다 (Ann Lab Med 2020; 40(4): 326-330).",6
150,SEQ,LPE243,"본 환자에서 NOTCH3 유전자에 대한 direct sequencing 결과, Likely Pathogenic로 분류되는 c.1630C>T, p.(Arg544Cys) 변이가 Heterozygous로 관찰되었습니다. 상기 변이는 한국인 인구집단(KRGDB)에서 0.0007의 빈도로 보고되었으며, 동아시아 CADASIL 환자에서 자주 발견되는 변이입니다 (PMID: 26308724, 31792094, 34881353). 또한, EGFr 도메인 간 구역에 위치한 cysteine-altering variant로 mild phenotype과 late disease onset과 연관되어 보고된 바 있습니다 (PMID: 32457593, 36606642). 따라서 상기 변이는 염기변이 해석에 관한 ACMG 가이드라인(PMID: 25741868)에 따라, 5 단계 염기변이 분류 기준 중 likely pathogenic에 해당합니다. 상기 변이의 보다 명확한 임상적 의의 규명을 위해 임상양상을 확인하시기 바라며, 가족구성원 간의 segregation study가 도움이 될 수 있으므로 환자의 가족검사를 추천합니다. 추가 검사 결과에 따라 변이의 최종분류 해석은 달라질 수 있습니다.",0
151,MLPA,LPE377,"PMP22 유전자에 대한 MLPA 분석결과, 본 환자에서 유전성 압박마비편향 신경병증(Hereditary neuropathy with liability to pressure palsies; HNPP) 및 샤르코-마리-투스병 1A 형(Charcot- Marie-Tooth disease, type 1A )과 관련된 PMP22 유전자의 결실 및 중복은 관찰되지 않습니다. ",0
152,Genetic,,이는 TTNtv 변이입니다 (TTN유전자의 truncating variant).,17
153,MLPA,LPE322,"1. MLPA 분석 결과, 질환과 관련된 SMN1 유전자의 exon 7 homozygous deletion (2 copy 소실)이 관찰되며 Spinal Muscular Atrophy(SMA) 환자로 판단됩니다. 
2. SMN2의 exon 7 과 exon 8 의 중복이나 결실은 관찰되지 않습니다. SMN2는 2 copy이며, SMA 환자에서 SMN2 유전자의 copy number는 임상양상에 중요한 인자가 되므로 참고하시기 바랍니다 (Trends Neurosci. 2021;44(4):306-322).
3. 추가적으로, 인접한 NAIP 유전자 exon 5의 2copy 소실이 관찰되며, 이는 SMA 환자에서 불량한 예후와 관련이 있다는 보고가 있습니다 (J Clin Neurol. 2017; 13(1): 27-31).
Summary) SMN1 exon 7: 0 copy /  SMN2: 2 copy /  NAIP exon 5: 0 copy 이며, 연령을 고려하였을때 nusinersen (스핀라자, 바이오젠), onasemnogene abeparvovec (졸겐스마, 노바티스), risdiplam (에브리스디, 로슈)와 같은 유전자 치료제 적응증에 해당 될 수 있습니다.",3
154,SEQ,LPE494,"본 환자에서 CFH 유전자에 대한 direct sequencing 결과, 질환 관련 돌연변이는 관찰되지 않았습니다. 추가적으로 시행한 CFH유전자의 MLPA 분석에서, CFHR1/CFHR4 deletion이 heterozygous로 관찰되었습니다. 또한, exon 22의 8.8 kb Downstream 위치에서도 heterozygous deletion이 관찰되었습니다. 이는 CFH-CFHRs genetic abnormalities의 결과로 생각되나, compound heterzygousity 여부는 확인이 어렵습니다. 환자의 임상적 예후와 관련하여 해석하시기 바랍니다. (CFH-CFHRs genetic abnormalities와 관련된 보고 문헌: J Am Soc Nephrol. 2020;31(2):241-256. J Am Soc Nephrol. 2016;27(6):1617-24. J Am Soc Nephrol. 2018;29(1):240-249. J Am Soc Nephrol. 2015;26(1):209-19. Kidney Int. 2017;92(4):876-887. Pediatr Nephrol. 2013;28(11):2221-5.).",0
155,Genetic,,"변이가 Exon 말단에 위치하여 Splicing에 영향을 주는 것으로 예측 되는 경우, RNA sequencing을 통한 splicing 이상을 확인하는 것이 도움이 될 수 있습니다.",16
156,Genetic,,"해당 변이는 exon 2 skip의 aberrant splicing을 일으킬 것으로 예측되나, 전체 transcript 길이의 10%미만에 해당하여 PVS1_Moderate 근거 수준으로 반영하였습니다 (PMID: 30192042).",15
157,SEQ,LPE302,"LHON 환자에서 m.14502T>C가 homoplasmy로 발견되어 보고된 바 있습니다 (PMID: 33858285, 37277661). ",0
158,SEQ,LPE243,"본 환자에서 NOTCH3 유전자에 대한 direct sequencing 결과, Likely Pathogenic로 분류되는 c.2901_2915del, p.(Ser968_Leu972del) 변이가 Heterozygous로 관찰되었습니다. 상기 변이는 population database와 ClinVar, HGMD에 보고된 바 없는 변이로, EGFr domain 26에 위치하여 971번째 아미노산 cystien residue의 deletion을 포함하는 cystein altering 변이입니다. CADASIL 환자군에서 EGFr domain 26에 위치하는 변이 빈도가 통계적으로 정상 대조군에 비해 높은 보고가 있습니다 (PMID: 36535904). 따라서 상기 변이는 염기변이 해석에 관한 ACMG 가이드라인(PMID: 25741868)에 따라, 5 단계 염기변이 분류 기준 중 likely pathogenic에 해당합니다. 상기 변이의 보다 명확한 임상적 의의 규명을 위해 임상양상을 확인하시기 바라며, 가족구성원 간의 segregation study가 도움이 될 수 있으므로 환자의 가족검사를 추천합니다. 추가 검사 결과에 따라 변이의 최종분류 해석은 달라질 수 있습니다.",0
159,MLPA,LPE322,"본 환자에서 관찰되는 SMN1 exon7, exon8의 복제수 증가(copy number 3)과 SMN2 exon7, exon8의 결실(copy number 1)은 한국인을 대상으로 한 연구에 따르면 정상인의 약 1.5%에서 발견되는 copy number variation입니다 (Ann Lab Med 2020; 40(4): 326-330).",8
160,SEQ,LPE245,환자 가족에 대한 추가 검사 및 유전상담이 유전적 변이의 의의 판정과 위험군의 조기진단에 유용하므로 환자의 가족검사와 유전상담을 추천합니다.,2
161,Genetic,,"본 환자에서 Genetic Endocrine disorders (538 genes) 에 대한 targeted panel sequencing 결과, 질환 관련 돌연변이는 관찰되지 않았습니다. 추가적으로 Hereditary Paraganglioma-Pheochromocytoma Syndromes 관련 MAX, SDHA, SDHAF2, SDHB, SDHC, SDHD, TMEM127 유전자와 Von Hippel-Lindau Syndrome 관련 VHL 유전자에서도 질환관련 변이는 관찰되지 않았습니다. 단, 유전성 질환의 일부에서는 deletion/duplication 변이가 원인인 경우가 있습니다. Deletion/duplication 변이는 본 NGS검사로 검출되지 않으며, 임상적으로 Von Hippel-Lindau Syndrome 질환이 강하게 의심되는 경우, VHL gene MLPA [LPE369]를 시행해 볼 수 있습니다.",14
162,Genetic,,"[가족검사에 의한 추가수정보고 2024-05-20] 추가적으로 진행한 가족검사 결과, 환자 검체에서 확인되었던 MYBPC3, c.713G>A 변이는 환자의 부친 검체에서, TNNI3K, c.2236_2238del 변이는 환자의 모친 검체에서 각각 이형접합 형태로 확인되었습니다. 해당 변이들은 추가적인 근거가 되는 de novo변이는 아닌 것으로 판단됩니다. 가족내의 임상양상과 관련하여 해석하시기 바라며, 유전자 및 질환마다 침투율(penetrance)과 표현도(expressivity)는 다양할 수 있습니다. ",13
