id,type,code,comment,seq
78,SEQ,LPC101,"본 환자에서 BRCA2 유전자에 대한 direct sequencing 결과, VUS (Variant of Unknown Significance)로 분류되는 c.10221del, p.(Asn3407Lysfs*20) 변이가 Heterozygous로 관찰되었습니다. 상기 변이는 population database에서 보고된 적 없는 frameshifting deletion mutation로 exon 27 아미노산 서열의 truncation을 일으키지만, 마지막 exon부분의 truncation은 임상적 중요성이 줄어듭니다 (Genet Med. 2019;21(2):293-302. PMID: 29988080), (Nat Genet. 1996;14(3):253-4. PMID: 8896551). 따라서 상기 변이는 염기변이 해석에 관한 ACMG 가이드라인(PMID: 25741868)과 PVS1 recommendation (PMID: 30192042)에 따라, 5 단계 염기변이 분류 기준 중 VUS에 해당합니다. 상기 변이의 보다 명확한 임상적 의의 규명을 위해 임상양상을 확인하시기 바라며, 가족구성원 간의 segregation study 가 도움이 될 수 있으므로, 환자의 가족검사를 추천합니다. 같은 표현형의 가족에서 추가 검사 결과에 따라 변이의 최종분류 해석은 달라질 수 있습니다.",3
79,SEQ,LPE243,"NOTCH3 유전자의 과오돌연변이는 NOTCH3 단백내 34개의 EGFr 도메인 내의 cysteine이 관여되는 과오돌연변이이며, 본 환자에서처럼 cysteine이 관여되지 않는 과오변이일 경우, 변이의 임상적 의의에 대한 신중한 해석을 권고하고 있습니다(Rutten JW et al., Expert Rev Mol Diagn. 2014). 이와 같이 cysteine이 관여되지 않은 과오변이의 보다 명확한 임상적 의의 규명을 위해, 임상진단을 재평가할 필요가 있으며, 임상증상이 CADASIL에 합당할 경우 피부생검으로 확진할 필요가 있습니다. 피부 생검에서도 CADASIL에 전형적인 혈관벽의 이상이 관찰될 경우 유전 상담 및 가족 검사를 통한 segregation analysis와 MLPA등의 추가적인 검사가 필요합니다. ",0
80,SEQ,LPC100,"상기 변이는 염기변이 해석에 관한 ACMG 가이드라인에 따라 (PMID: 25741868), 5 단계 염기변이 분류 기준 중 VUS에 해당합니다. 상기 변이의 보다 명확한 임상적 의의 규명을 위해 임상양상을 확인하시기 바라며 가족구성원 간의 segregation study 가 도움이 될 수 있으므로 환자의 가족검사를 추천합니다. ",8
81,SEQ,LPE243,"이 변이는 gnomAD population database에서 0.0024(Korean KRGDB)와 0.000027(Global)의 빈도로 보고된 바 있습니다. 다수의 컴퓨터 기반 in silico분석에서 유전자의 기능에 손상을 주는것으로 예측됩니다. ",0
82,SEQ,LPE243,"위 근거들을 종합하면 상기 변이는 염기변이 해석에 관한 ACMG 가이드라인에 따라 (PMID: 25741868), 5 단계 염기변이 분류 기준 중 VUS에 해당합니다. 상기 변이의 보다 명확한 임상적 의의 규명을 위해 임상양상을 확인하시기 바라며 가족구성원 간의 segregation study 가 도움이 될 수 있으므로 환자의 가족검사를 추천합니다. 추가 검사 결과에 따라 변이의 최종분류 해석은 달라질 수 있습니다.",0
84,Genetic,,"본 환자에서 Hereditary hemolytic anemia (48 genes) 에 대한 targeted panel sequencing 결과, 질환 관련 돌연변이는 관찰되지 않았습니다. 그 외에 secondary finding으로, RYR1 유전자에서 Pathogenic로 분류되는 c.14693T>C, p.(Ile4898Thr) 변이가 Heterozygous로 관찰되었습니다. RYR1 유전자는 Malignant hyperthermia와 연관되며, 수술 및 시술 중에 사용되는 특정 흡입 마취제에 대한 심각한 부작용을 야기할 수 있는 것으로 알려져 있습니다.",30
86,SEQ,LPC100,"본 환자에서 BRCA2 유전자에 대한 direct sequencing 결과, Likely Pathogenic으로 분류되는 c.8954-5A>G, 변이가 Heterozygous로 관찰되었습니다. 상기 변이는 population database에서 다음과 같이 낮은 빈도로 보고되었습니다 (0.00000 in gnomAD-Global). 해당 변이는 exon/intron 경계에서 5번째에 위치하고 있으며, HGMD의 여러 문헌에서 aberrant splicing을 일으키는 변이로 보고된 바 있습니다 (PubMed: 29280214, 24607278, 21735045).  상기 변이는 염기변이 해석에 관한 ACMG 가이드라인에 따라 (PMID: 25741868), 5 단계 염기변이 분류 기준 중 Likely pathogenic에 해당합니다. 상기 변이의 보다 명확한 임상적 의의 규명을 위해 임상양상을 확인하시기 바라며 가족구성원 간의 segregation study 가 도움이 될 수 있으므로 환자의 가족검사를 추천합니다. ",9
87,SEQ,LPC101,"본 환자에서 BRCA2 유전자에 대한 direct sequencing 결과, Likely Pathogenic으로 분류되는 c.8954-5A>G, 변이가 Heterozygous로 관찰되었습니다. 상기 변이는 population database에서 다음과 같이 낮은 빈도로 보고되었습니다 (0.00000 in gnomAD-Global). 해당 변이는 exon/intron 경계에서 5번째에 위치하고 있으며, HGMD의 여러 문헌에서 aberrant splicing을 일으키는 변이로 보고된 바 있습니다 (PubMed: 29280214, 24607278, 21735045).  상기 변이는 염기변이 해석에 관한 ACMG 가이드라인에 따라 (PMID: 25741868), 5 단계 염기변이 분류 기준 중 Likely pathogenic에 해당합니다. 상기 변이의 보다 명확한 임상적 의의 규명을 위해 임상양상을 확인하시기 바라며 가족구성원 간의 segregation study 가 도움이 될 수 있으므로 환자의 가족검사를 추천합니다. ",4
88,SEQ,LPC100,"본 환자에서 PKD1 유전자에 대한 direct sequencing 결과, VUS (Variant of Unknown Significance)로 분류되는 c.9548G>A, p.(Arg3183Gln) 변이가 Heterozygous로 관찰되었습니다. 이 변이는 population database에서 0.0036(Korean)와 0.00037(Global)의 빈도로 보고된 바 있습니다. 이 변이는 기존 문헌(PubMed: 25074460)에서 한 가계의 Likely pathogenic 변이로 보고된 바 있으나, 다른 문헌(PubMed:27782177, 22383692)에는 VUS로, 또 다른 일부(PubMed:22185115, 27835667)에서는 Benign으로 보고된 바 있습니다. 다수의 컴퓨터 기반 알고리즘분석에서는 유전자의 기능에 대한 영향이 서로 상이하게 예측됩니다. 위 근거들을 종합하면 상기 변이는 염기변이 해석에 관한 ACMG 가이드라인에 따라 (PMID: 25741868), 5 단계 염기변이 분류 기준 중 VUS에 해당합니다. 상기 변이의 보다 명확한 임상적 의의 규명을 위해 임상양상을 확인하시기 바라며 가족구성원 간의 segregation study 가 도움이 될 수 있으므로 환자의 가족검사를 추천합니다. 이환된 가족의 검사 결과의 동반에 따라 변이의 최종분류 해석은 달라질 수 있습니다.",10
89,SEQ,LPE275,"본 환자에서 PKD1 유전자에 대한 direct sequencing 결과, VUS (Variant of Unknown Significance)로 분류되는 c.9548G>A, p.(Arg3183Gln) 변이가 Heterozygous로 관찰되었습니다. 이 변이는 population database에서 0.0036(Korean)와 0.00037(Global)의 빈도로 보고된 바 있습니다. 이 변이는 기존 문헌(PubMed: 25074460)에서 한 가계의 Likely pathogenic 변이로 보고된 바 있으나, 다른 문헌(PubMed:27782177, 22383692)에는 VUS로, 또 다른 일부(PubMed:22185115, 27835667)에서는 Benign으로 보고된 바 있습니다. 다수의 컴퓨터 기반 알고리즘분석에서는 유전자의 기능에 대한 영향이 서로 상이하게 예측됩니다. 위 근거들을 종합하면 상기 변이는 염기변이 해석에 관한 ACMG 가이드라인에 따라 (PMID: 25741868), 5 단계 염기변이 분류 기준 중 VUS에 해당합니다. 상기 변이의 보다 명확한 임상적 의의 규명을 위해 임상양상을 확인하시기 바라며 가족구성원 간의 segregation study 가 도움이 될 수 있으므로 환자의 가족검사를 추천합니다. 이환된 가족의 검사 결과의 동반에 따라 변이의 최종분류 해석은 달라질 수 있습니다.",0
90,SEQ,LPE276,"본 환자에서 PKD1 유전자에 대한 direct sequencing 결과, VUS (Variant of Unknown Significance)로 분류되는 c.9548G>A, p.(Arg3183Gln) 변이가 Heterozygous로 관찰되었습니다. 이 변이는 population database에서 0.0036(Korean)와 0.00037(Global)의 빈도로 보고된 바 있습니다. 이 변이는 기존 문헌(PubMed: 25074460)에서 한 가계의 Likely pathogenic 변이로 보고된 바 있으나, 다른 문헌(PubMed:27782177, 22383692)에는 VUS로, 또 다른 일부(PubMed:22185115, 27835667)에서는 Benign으로 보고된 바 있습니다. 다수의 컴퓨터 기반 알고리즘분석에서는 유전자의 기능에 대한 영향이 서로 상이하게 예측됩니다. 위 근거들을 종합하면 상기 변이는 염기변이 해석에 관한 ACMG 가이드라인에 따라 (PMID: 25741868), 5 단계 염기변이 분류 기준 중 VUS에 해당합니다. 상기 변이의 보다 명확한 임상적 의의 규명을 위해 임상양상을 확인하시기 바라며 가족구성원 간의 segregation study 가 도움이 될 수 있으므로 환자의 가족검사를 추천합니다. 이환된 가족의 검사 결과의 동반에 따라 변이의 최종분류 해석은 달라질 수 있습니다.",0
91,Genetic,,"가족에서의 해당 변이의 염기서열 분석결과: 주이수 모. WAS, c.223G>A, Detected, heterozygous.  주이수 부. WAS, c.223G>A, Not detected. 
환자의 어머니는 Female carrier에 해당하며, 이 경우 일반적으로는 임상 증상을 나타내지 않습니다. 다만, Female carrier에서도 경미한 혈소판 감소증이 간혹 관찰 될 수 있으며, 아주 드문 경우에는 Wiskott-Aldrich 증후군의 전형적인 증상을 나타낼 수 있다는 보고도 있으므로, 임상 양상을 확인하시기 바랍니다.",31
92,MLPA,LPE332,"CYP21A2 유전자에 대한 MLPA 분석결과, CYP21A2 유전자(active gene)의 Exon 1 에서 heterozygous large gene deletion (이형접합결실) 이 관찰됩니다. 또한, 본 환자에서 이전에 시행했던 CYP21A2 유전자에 대한 직접염기서열분석결과, 21-hydroxylase deficiency(21-OHD)의 원인돌연변이인 c.293-13C>G가 이형접합형태로 관찰되었습니다. 이러한 두 가지 유전적 변이를 종합해 볼 때, 이는 21-OHD 결핍에 의한 선천성부신증식증 환자에 해당하는 소견입니다. 또한, 두 이형접합 변이의 cis- 혹은 trans- 상태를 확인을 위해서 부모 두 분의 가족검사로 추가적인 확인을 시행해 볼 수 있습니다. 결과설명, 유전상담, 또는 추가검사가 필요한 경우 진단검사의학과로 의뢰 주시기 바랍니다.",0
93,MLPA,LPE322,"환자의 SMA MLPA 검사 결과 SMN1 exon 7, 8의 copy 수 증가(ratio: 1.5, copy number: 3)와 SMN2 exon 7, 8 의 완전 결실(ratio: 0, copy number: 0)이 관찰되었으나, 이러한 소견은 정상인에서도 나타날 수 있는 변이(normal variation)로 알려져 있습니다. (J Med Genet. 2009 Sep;46(9):641-4)",9
94,SEQ,LPE275,"본 환자에서 PKD1 유전자에 대한 sequencing 결과, Likely Pathogenic로 분류되는 c.6842C>T, p.(Ser2281Phe) 변이가 Heterozygous로 관찰되었습니다. 이 변이는 population database에서 관찰된 바 없는 새로운 변이 이며, 돌연변이가 자주 보고되는 도메인(hot spot)에 위치하고 있습니다. 또한, 다수의 컴퓨터 기반 알고리즘분석에서 유전자의 기능에 손상을 주는것으로 예측됩니다 (11 pathogenic predictions from BayesDel_addAF, DANN, DEOGEN2, EIGEN, FATHMM-MKL, LIST-S2, M-CAP, MVP, MutationAssessor, MutationTaster and SIFT). 위 근거들을 종합하면 상기 변이는 염기변이 해석에 관한 ACMG 가이드라인에 따라 (PMID: 25741868), 5 단계 염기변이 분류 기준 중 Likely pathogenic 에 해당합니다. 상기 변이의 보다 명확한 임상적 의의 규명을 위해 임상양상을 확인하시기 바라며 가족구성원 간의 segregation study 가 도움이 될 수 있으므로 환자의 가족검사를 추천합니다. ",0
95,SEQ,LPE276,"본 환자에서 PKD1 유전자에 대한 sequencing 결과, Likely Pathogenic로 분류되는 c.6842C>T, p.(Ser2281Phe) 변이가 Heterozygous로 관찰되었습니다. 이 변이는 population database에서 관찰된 바 없는 새로운 변이 이며, 돌연변이가 자주 보고되는 도메인(hot spot)에 위치하고 있습니다. 또한, 다수의 컴퓨터 기반 알고리즘분석에서 유전자의 기능에 손상을 주는것으로 예측됩니다 (11 pathogenic predictions from BayesDel_addAF, DANN, DEOGEN2, EIGEN, FATHMM-MKL, LIST-S2, M-CAP, MVP, MutationAssessor, MutationTaster and SIFT). 위 근거들을 종합하면 상기 변이는 염기변이 해석에 관한 ACMG 가이드라인에 따라 (PMID: 25741868), 5 단계 염기변이 분류 기준 중 Likely pathogenic 에 해당합니다. 상기 변이의 보다 명확한 임상적 의의 규명을 위해 임상양상을 확인하시기 바라며 가족구성원 간의 segregation study 가 도움이 될 수 있으므로 환자의 가족검사를 추천합니다. ",0
96,SEQ,LPE287,"본 환자에서 RET 유전자에 대한 exon 8, 10, 11, 13, 14, 15, 16 및 인접 flanking region의 염기서열 direct sequencing 결과, 질환 관련 돌연변이는 관찰되지 않았습니다.",0
97,SEQ,LPE245,"본 환자에서 NF1 유전자에 대한 direct sequencing 결과, VUS (Variant of Unknown Significance)로 분류되는 c.4930G>C, p.(Asp1644His) 변이가 Heterozygous로 관찰되었습니다. 해당 변이는 population database에서 보고된 바 없으며, HGMD에서 1예 보고된 바 있습니다 (CM1512957, PMID: 26740943). ClinVar에서는 VUS로 분류되었습니다 (VCV000527458.1). 해당 변이는 다수의 컴퓨터 기반 알고리즘분석에서 유전자의 기능에 손상을 주는것으로 예측됩니다. 또한, 같은 아미노산 위치에서 다른 종류의 아미노산 단백 변화변이(Asp1644Tyr, Asp1644Gly)가 병원성으로 보고된 적이 있습니다 (PMID: 23656349). 위 근거들을 종합하면 상기 변이는 염기변이 해석에 관한 ACMG 가이드라인에 따라 (PMID: 25741868), 5 단계 염기변이 분류 기준 중 VUS에 해당합니다. 상기 변이의 보다 명확한 임상적 의의 규명을 위해 임상양상을 확인하시기 바라며, 필요시 가족구성원 간의 segregation study 가 도움이 될 수 있으므로 환자의 가족검사를 추천합니다. 추가 검사 결과에 따라 환자의 변이가 De novo로 확인될 경우 변이의 최종분류 해석은 병인성으로 달라질 수 있습니다.",9
98,SEQ,LPE221,"본 환자에서 PARK2 유전자에 대한 direct sequencing 결과, Likely Pathogenic로 분류되는 c.986G>A, p.(Gly329Asp) 변이가 Heterozygous로 관찰되었으며, 또한 VUS (Variant of Unknown Significance)로 분류되는 c.1285+5G>A 변이가 Heterozygous로 관찰되었습니다. 상염색체 열성으로 유전하는 질환에서 하나의 pathogenic 변이가 관찰되었으므로, 다음의 두 가지 사항을 추천합니다. (1) PARK2 MLPA 검사[LPE464], (2) VUS 변이의 명확한 임상적 의의 규명을 위한 환자의 가족검사.

아래는 관찰된 두 변이에 대한 세부분석 내용입니다.
1) c.986G>A 변이: 해당 변이는 population database에서 다음과 같이 낮은 빈도로 보고되었으며 (0.00001194 in gnomAD-Global), 돌연변이가 자주 보고되는 부위에 위치해있습니다. 같은 아미노산 위치에서 다른 종류의 아미노산 단백 변화(Gly329Val)가 병원성으로 보고된 바 있습니다 (CM2013146, PMID: 32446772). 다수의 컴퓨터 기반 알고리즘에서 유전자의 기능에 손상을 주는것으로 예측되며, 단백 변화변이가 질병 발생의 흔한 기전인 유전자에서 발생한 단백 변화 변이입니다. 상기 변이는 염기변이 해석에 관한 ACMG 가이드라인에 따라 (PMID: 25741868), 5 단계 염기변이 분류 기준 중 Likely pathogenic에 해당합니다. 
2) c.1285+5G>A 변이: 해당 변이는 population database에서 다음과 같이 낮은 빈도로 보고되었습니다 (0.0000039 in gnomAD-Global). 컴퓨터 기반 알고리즘에서 유전자의 기능에 손상을 주는것으로 예측됩니다. 상기 변이는 염기변이 해석에 관한 ACMG 가이드라인에 따라 (PMID: 25741868), 5 단계 염기변이 분류 기준 중 VUS에 해당합니다. 가족구성원 간의 segregation study 가 도움이 될 수 있으므로 환자의 가족검사를 추천합니다. 추가 검사 결과에 따라 환자의 변이가 de novo로 확인될 경우 변이의 최종분류 해석은 병인성으로 달라질 수 있습니다.",0
99,SEQ,LPC100,"본 환자에서 BRCA2 유전자에 대한 direct sequencing 결과, VUS (Variant of Unknown Significance)로 분류되는 c.7691C>G, p.(Thr2564Ser) 변이가 Heterozygous로 관찰되었습니다. 상기 변이는 population database에서 다음과 같이 낮은 빈도로 보고되었습니다 (0.0005 in KRGDB, 0.000012 in gnomAD-Global). 다수의 컴퓨터 기반 알고리즘분석에서 유전자의 기능에 영향이 없는 것으로 예측됩니다. (8 benign predictions from BayesDel_addAF, DANN, EIGEN, FATHMM-MKL, MVP, MutationTaster, PrimateAI and SIFT). 위 근거들을 종합하면 상기 변이는 염기변이 해석에 관한 ACMG 가이드라인에 따라 (PMID: 25741868), 5 단계 염기변이 분류 기준 중 VUS에 해당합니다. 상기 변이의 보다 명확한 임상적 의의 규명을 위해 임상양상을 확인하시기 바라며 가족구성원 간의 segregation study 가 도움이 될 수 있으므로 환자의 가족검사를 추천합니다. 추가 검사 결과에 따라 변이의 최종분류 해석은 달라질 수 있습니다.",3
100,SEQ,LPC101,"본 환자에서 BRCA2 유전자에 대한 direct sequencing 결과, VUS (Variant of Unknown Significance)로 분류되는 c.7691C>G, p.(Thr2564Ser) 변이가 Heterozygous로 관찰되었습니다. 상기 변이는 population database에서 다음과 같이 낮은 빈도로 보고되었습니다 (0.0005 in KRGDB, 0.000012 in gnomAD-Global). 다수의 컴퓨터 기반 알고리즘분석에서 유전자의 기능에 영향이 없는 것으로 예측됩니다. (8 benign predictions from BayesDel_addAF, DANN, EIGEN, FATHMM-MKL, MVP, MutationTaster, PrimateAI and SIFT). 위 근거들을 종합하면 상기 변이는 염기변이 해석에 관한 ACMG 가이드라인에 따라 (PMID: 25741868), 5 단계 염기변이 분류 기준 중 VUS에 해당합니다. 상기 변이의 보다 명확한 임상적 의의 규명을 위해 임상양상을 확인하시기 바라며 가족구성원 간의 segregation study 가 도움이 될 수 있으므로 환자의 가족검사를 추천합니다. 추가 검사 결과에 따라 변이의 최종분류 해석은 달라질 수 있습니다.",5
101,SEQ,LPC100,"본 환자에서 BRCA2 유전자에 대한 direct sequencing 결과, VUS (Variant of Unknown Significance)로 분류되는 c.7522G>A, p.(Gly2508Ser) 변이가 Heterozygous로 관찰되었습니다. 상기 변이는 population database에서 다음의 빈도로 보고되었습니다 (0.0034 in Korean, 0.000107 in dbSNP-Global). 상기 변이는 염기변이 해석에 관한 ACMG 가이드라인에 따라 (PMID: 25741868), 5 단계 염기변이 분류 기준 중 VUS에 해당합니다. HGMD의 여러 문헌과 ClinVar 보고들에서 일부는 VUS로, 일부는 Likely benign으로 서로 상이하게 보고된 바 있습니다. 상기 변이의 보다 명확한 임상적 의의 규명을 위해 임상양상을 확인하시기 바라며 가족구성원 간의 segregation study 가 도움이 될 수 있으므로 환자의 가족검사를 추천합니다. ",4
102,SEQ,LPC101,"본 환자에서 BRCA2 유전자에 대한 direct sequencing 결과, VUS (Variant of Unknown Significance)로 분류되는 c.7522G>A, p.(Gly2508Ser) 변이가 Heterozygous로 관찰되었습니다. 상기 변이는 population database에서 다음의 빈도로 보고되었습니다 (0.0034 in Korean, 0.000107 in dbSNP-Global). 상기 변이는 염기변이 해석에 관한 ACMG 가이드라인에 따라 (PMID: 25741868), 5 단계 염기변이 분류 기준 중 VUS에 해당합니다. HGMD의 여러 문헌과 ClinVar 보고들에서 일부는 VUS로, 일부는 Likely benign으로 서로 상이하게 보고된 바 있습니다. 상기 변이의 보다 명확한 임상적 의의 규명을 위해 임상양상을 확인하시기 바라며 가족구성원 간의 segregation study 가 도움이 될 수 있으므로 환자의 가족검사를 추천합니다. ",6
103,SEQ,LPE378,"UGT1A1 유전자 분석결과, 기보고된 돌연변이 (p.Arg209Trp)가 이형접합의 형태로 관찰되었습니다(Carrier state). 해당변이는, Gilbert 증후군과 같은 mild hyperbilirubinemia를 보이는 Crigler–Najjar syndrome type II 환자에서 동형접합의 형태 또는 복합 이형접합의 형태로 보고된 적이 있는 변이입니다 (Hum Mutat. 2010;31(1):52-9. Pharmacogenetics. 2001;11(7):639-42.).",0
104,SEQ,LPE378,"UGT1A1 유전자 분석결과, 기보고된 돌연변이 p.(Gly71Arg)가 이형접합의 형태로 관찰되었습니다(Carrier state). 위 돌연변이는 아시아 Gilbert syndrome 환자에서 가장 흔하게 관찰되는 돌연변이이며, transient familial neonatal hyperbilirubinemia의 원인 변이이기도 합니다(Akaba Ket al. J Hum Genet 1999;44:22-5). ",0
105,SEQ,LPE378,Gilbert 증후군의 필요조건으로 알려진 UGT1A1 유전자의 promoter 부위 TATA box의 A(TA)7TAA(UGT1A1*28) 돌연변이는 본 환자에서 발견되지 않았습니다.,0
106,SEQ,LPE245,"이 변이는 엑손/인트론 경계 부위에 위치하고 있으며, exon 54, 55를 포함하는 cDNA 염기서열분석에서 aberrant transcript는 관찰되지 않았습니다.",10
107,SEQ,LPE245,cDNA reverse transcribed RNA-adequate specimen. Genomic DNA isolated from peripheral blood leukocytes-adequate specimen,11
108,SEQ,LPE262,"본 환자에서 FBN1 유전자에 대한 direct sequencing 결과, Likely Pathogenic로 분류되는 c.7775G>T, p.(Cys2592Phe) 변이가 Heterozygous로 관찰되었습니다. 해당 변이는 돌연변이가 자주 보고되는 부위에 위치하고 있으며, 같은 아미노산 위치에서 다른 종류의 아미노산 단백 변화변이가 병원성으로 보고된 적이 있습니다. 해당 변이는 population database에서 보고된 바 없으며, 다수의 컴퓨터 기반 알고리즘분석에서 유전자의 기능에 손상을 주는것으로 예측됩니다. 상기 변이는 염기변이 해석에 관한 ACMG 가이드라인에 따라 (PMID: 25741868), 5 단계 염기변이 분류 기준 중 Likely Pathogenic에 해당합니다. 변이의 보다 명확한 임상적 의의 규명을 위해 가족구성원 간의 segregation study 가 도움이 될 수 있으므로 환자의 가족검사를 추천합니다. ",0
109,SEQ,LPE141,"본 환자에서 FBN1 유전자에 대한 direct sequencing 결과, Likely Pathogenic로 분류되는 c.7775G>T, p.(Cys2592Phe) 변이가 Heterozygous로 관찰되었습니다. 해당 변이는 돌연변이가 자주 보고되는 부위에 위치하고 있으며, 같은 아미노산 위치에서 다른 종류의 아미노산 단백 변화변이가 병원성으로 보고된 적이 있습니다. 해당 변이는 population database에서 보고된 바 없으며, 다수의 컴퓨터 기반 알고리즘분석에서 유전자의 기능에 손상을 주는것으로 예측됩니다. 상기 변이는 염기변이 해석에 관한 ACMG 가이드라인에 따라 (PMID: 25741868), 5 단계 염기변이 분류 기준 중 Likely Pathogenic에 해당합니다. 변이의 보다 명확한 임상적 의의 규명을 위해 가족구성원 간의 segregation study 가 도움이 될 수 있으므로 환자의 가족검사를 추천합니다. ",0
110,SEQ,LPE245,"이 변이는 틀이동 변이로 null variant이며, population database에서는 보고된 바 없습니다. 위 근거들을 종합하면 상기 변이는 염기변이 해석에 관한 ACMG 가이드라인에 따라 (PMID: 25741868), 5 단계 염기변이 분류 기준 중 Likely pathogenic 에 해당합니다. 상기 변이의 보다 명확한 임상적 의의 규명을 위해 임상양상을 확인하시기 바라며 가족구성원 간의 segregation study 가 도움이 될 수 있으므로 환자의 가족검사를 추천합니다. 추가 검사 결과에 따라 변이의 최종분류 해석은 달라질 수 있습니다.",12
