id,type,code,comment,seq
163,SEQ,LPE494,"본 환자에서 CFH 유전자에 대한 sequencing 결과, 질환 관련 small intraexonic 변이는 관찰되지 않았습니다. 추가적으로 시행한 CFH유전자의 MLPA 분석에서, CFHR3-CFHR1 deletion이 heterozygous로 관찰되었습니다. CFHR3-CFHR1 deletion은 homozygous일때 aHUS와 관련되는 것으로 알려져 있습니다 (CFH-CFHRs genetic abnormalities와 관련된 보고 문헌: J Am Soc Nephrol. 2020;31(2):241-256). 일반적으로 상염색체 열성 질환의 경우 두 개의 대립 유전자에 모두 이상이 있을 때 이환되고, 대립 유전자 하나에만 이상이 있을 시 이환되지 않습니다. 단, 본 검사로 검출되지 않는 큰 결실 및 중복, deep intron 돌연변이 등을 동반할 가능성을 배제할 수 없으므로, 임상 양상과 관련하여 해석하시기 바랍니다.",0
164,Genetic,,"*또한, Secondary finding에 해당하는 질환관련 변이는 관찰되지 않았습니다. Secondary finding은 유전자검사를 의뢰한 환자의 주증상과 관련이 없더라도 Cancer, Cardiovascular, Metabolism 등과 관련된 71개의 유전자에서 Pathogenic 또는 Likely pathogenic 변이가 관찰된 경우를 말하며, 검사 의뢰시 환자 동의하에 보고됩니다.",4
165,SEQ,LPE287,"환자의 임상양상을 확인하시기 바라며, 환자 가족에 대한 추가 검사 및 유전상담이 유전적 변이의 의의 판정과 위험군의 조기진단에 유용하므로 환자의 가족검사를 추천합니다. ",0
166,SEQ,LPC100,"상기 변이는 염기변이 해석에 관한 ACMG 가이드라인에 따라 (PMID: 25741868), 5 단계 염기변이 분류 기준 중 VUS에 해당합니다. 상기 변이의 보다 명확한 임상적 의의 규명을 위해 임상양상을 확인하시기 바라며 가족구성원 간의 segregation study 가 도움이 될 수 있으므로 환자의 가족검사를 추천합니다. 추가 검사 결과에 따라 변이의 최종분류 해석은 달라질 수 있습니다.",2
167,SEQ,LPC101,"상기 변이는 염기변이 해석에 관한 ACMG 가이드라인에 따라 (PMID: 25741868), 5 단계 염기변이 분류 기준 중 VUS에 해당합니다. 상기 변이의 보다 명확한 임상적 의의 규명을 위해 임상양상을 확인하시기 바라며 가족구성원 간의 segregation study 가 도움이 될 수 있으므로 환자의 가족검사를 추천합니다. 추가 검사 결과에 따라 변이의 최종분류 해석은 달라질 수 있습니다.",9
168,MLPA,LPE322,"본 환자에서 관찰되는 SMN1 exon7, exon8의 복제수 증가(copy number 3)은 한국인을 대상으로 한 연구에 따르면 정상인의 약 2.0%에서 발견되는 copy number variation입니다 (Ann Lab Med 2020; 40(4): 326-330).",7
169,SEQ,LPE141,"임상적으로 '유전성 대동맥질환'이 강하게 의심되나 본 검사에서 음성인 경우, [LPE490] 유전성 대동맥질환 NGS를 처방해서 확인하시는 것을 추천드립니다.",0
170,Genetic,,"**일부 환자에서는 deletion/duplication 변이가 원인으로 발견되는 경우도 있습니다. Deletion/duplication, deep intron 변이는 본 NGS검사로 검출되지 않으며, MLPA, Microarray, 또는 Whole genome sequencing 검사가 도움이 될 수 있습니다. ",10
171,SEQ,LPE494,"본 환자에서 CFH 유전자에 대한 direct sequencing 결과, 염기서열에서는 질환 관련 돌연변이가 관찰되지 않았습니다. 추가적으로 시행한 CFH유전자의 MLPA 분석에서, Del.CFHR1/Dup.CFHR4이 heterozygous로 관찰되었습니다 (= CFHR1 1 copy and CFHR4 3 copies). 이는 CFH-CFHRs hybrid로 인한 gene conversion과 같은 genetic abnormalities의 결과로 생각되며, 이로 인한 기능적 결과는 명확히 알려져 있지는 않으나, 다양한 CFH-CFHRs hybrid에 의한 Factor H plasma level에 영향이 있을 수 있다는 여러 보고가 있습니다. (CFH-CFHRs genetic abnormalities와 관련된 보고 문헌: J Am Soc Nephrol. 2020;31(2):241-256. J Am Soc Nephrol. 2016;27(6):1617-24. J Am Soc Nephrol. 2018;29(1):240-249. J Am Soc Nephrol. 2015;26(1):209-19. Kidney Int. 2017;92(4):876-887. Pediatr Nephrol. 2013;28(11):2221-5.).",0
172,SEQ,LPE295,"유전자 및 질환마다 침투율(penetrance)과 표현도(expressivity)가 다양할 수 있으므로, 임상양상과 관련하여 해석하시기 바라며, 필요한 경우 관련 가족검사와 유전상담을 권고드립니다.",0
173,MLPA,LPE322,"환자의 MLPA검사 결과, SMN1 유전자의 exon7, 8의 1 copy 소실인 heterozygous deletion이 관찰되어 보인자로 판단됩니다. (SMN1 exon7, exon8 각각 1 copy detected). 
Heterozygous deletion detected (carrier)",2
174,SEQ,LPE227,"본 환자에서 CYP21A2 유전자에 대한 direct sequencing 결과, Likely Pathogenic (carrier)로 분류되는 c.1139_1140del, p.(Glu380GlyfsTer15) 변이가 Heterozygous로 관찰되었습니다. 상염색체 열성 질환에서, 본 검사에서 원인 변이 1개가 발견되었으므로, 임상적으로 해당 질환이 의심될 경우 정확한 진단을 위해서, 위 변이와 Copy number variation의 compound heterozygotes 여부에 대한 감별이 필요합니다. 전체 돌연변이의 약 20-30%를 차지하는 Gene deletion/duplication 의 확인을 위해 CYP21A2 MLPA 검사(LPE332)를 추천합니다.",0
175,Genetic,,Amniotic fluid specimen 을 이용하여 검사 진행한 결과입니다.,6
176,SEQ,LPE141,"임상적으로 Loeys-Dietz Syndrome 등 다른 결합조직 질환의 감별도 필요하나 본 검사에서 음성인 경우, TGFBR1 sequencing [LPE374], TGFBR2 sequencing [LPE375], 또는 유전성 결합조직 질환 NGS [LPE525]을 처방해서 확인하시기 바랍니다.",0
177,Genetic,,"임상적으로 Legius Syndrome이 강하게 의심되나 본 검사에서 음성인 경우, 전체 돌연변이의 약 10%를 차지하는 Gene deletion/duplication 의 확인을 위해 추가적인 검사를 추천드립니다. 
Deletion, duplication을 포함한 copy number alteration, structural variation, deep intron variant, non-coding region variant 등의 변이는 본 NGS검사로 검출이 어려울 수 있으며, 이러한 경우 Whole genome sequencing이 권장되므로, 필요시 진단검사의학과 전문의에게 의뢰주시기 바랍니다. ",12
178,Genetic,,"추가적으로 분석 및 검토 진행한 아래의 유전자들에서 질환관련 변이는 관찰되지 않았습니다.
(TUBA1A, TUBB2B, TUBB3, TUBA8, TUBB, POMT1, POMT2, ADGRG1, PAFAH1B1, DCX, TUBB4A, TUBG1, TUBB2A, ZIC4, POMGNT1, POMGNT2, B3GALNT2, DAG1, PIGT)",7
179,SEQ,LPE115,"**임상적으로 Familial Hypercholesterolemia가 강하게 의심되나 본 검사에서 음성인 경우, APOB, LDLRAP1, PCSK 유전자를 포함하고 있는 [LPE533] 유전성 내분비질환 NGS를 처방해서 확인하시기 바랍니다.",0
